{
  "schema_version": "1.0.0-node",
  "plan_id": "nodo-3b4e89fe7928dab60e21",
  "revision": 2,
  "node": {
    "key": "ITESCA/maestria-en-gestion-administrativa/fundamentos-de-gestion-administrativa-mga/actividad-1",
    "level": "actividad",
    "parent_key": "ITESCA/maestria-en-gestion-administrativa/fundamentos-de-gestion-administrativa-mga",
    "relative_path": "ITESCA/maestria-en-gestion-administrativa/fundamentos-de-gestion-administrativa-mga",
    "label": "Actividad 1"
  },
  "profile": {
    "activity_id": "7780",
    "offering_id": "oferta-bd29a4a4059c1103",
    "purpose": null,
    "product_ids": [
      "product-001"
    ],
    "completion_checks": []
  },
  "editorial_rules": {},
  "provenance": [
    {
      "path": "/profile",
      "state": "unknown",
      "reason": "Perfil pendiente de fuentes y cotejo; no es una planeacion ejecutable.",
      "evidence": [],
      "alternatives": []
    }
  ],
  "review": {
    "state": "needs_review",
    "semantic_validation": "failed",
    "critical_gaps": [
      "Perfil y fuentes pendientes de cotejo; publicacion no habilita ejecucion"
    ]
  },
  "bindings": {
    "parent_plan": {
      "path": "ITESCA/maestria-en-gestion-administrativa/fundamentos-de-gestion-administrativa-mga/planeaciones-fundamentos-de-gestion-administrativa/canonicas/nodo-98df45c9a0047dd1d27c/r0001/planeacion.json",
      "sha256": "42880e623fccc47f5459d90e0ea45d10c5cd247724d4c4d1e8998443b88a1659",
      "activity_id": null
    },
    "pedagogical_plan": {
      "path": "ITESCA/maestria-en-gestion-administrativa/fundamentos-de-gestion-administrativa-mga/planeaciones-fundamentos-de-gestion-administrativa/importaciones/pca-7d9cf2c2278a59d1c581/r0002/planeacion.json",
      "sha256": "84183c71b209906b26f4586b65d45718927f5de6777e6113a484c5a32c2503aa",
      "activity_id": "7780"
    }
  }
}
