{
  "schema_version": "1.0.0-node",
  "plan_id": "nodo-a9f494802508c74324d4",
  "revision": 1,
  "node": {
    "key": "ITESCA/maestria-en-gestion-administrativa/plan-de-negocios-mga/actividad-4",
    "level": "actividad",
    "parent_key": "ITESCA/maestria-en-gestion-administrativa/plan-de-negocios-mga",
    "relative_path": "ITESCA/maestria-en-gestion-administrativa/plan-de-negocios-mga",
    "label": "Actividad 4"
  },
  "profile": {
    "activity_id": "6539",
    "offering_id": "oferta-806a6822d72a74d2",
    "purpose": null,
    "product_ids": [
      "product-001"
    ],
    "completion_checks": []
  },
  "editorial_rules": {},
  "provenance": [
    {
      "path": "/profile",
      "state": "unknown",
      "reason": "Perfil pendiente de fuentes y cotejo; no es una planeacion ejecutable.",
      "evidence": [],
      "alternatives": []
    }
  ],
  "review": {
    "state": "needs_review",
    "semantic_validation": "failed",
    "critical_gaps": [
      "Perfil y fuentes pendientes de cotejo; publicacion no habilita ejecucion"
    ]
  },
  "bindings": {
    "parent_plan": {
      "path": "ITESCA/maestria-en-gestion-administrativa/plan-de-negocios-mga/planeaciones-plan-de-negocios/canonicas/nodo-942dfb94aaef11145391/r0001/planeacion.json",
      "sha256": "45a9b8d9ee921cdb8394929f5f4e01ded6dc88bb99a1c014c9198bdd9afe310e",
      "activity_id": null
    },
    "pedagogical_plan": {
      "path": "ITESCA/maestria-en-gestion-administrativa/plan-de-negocios-mga/planeaciones-plan-de-negocios/importaciones/pca-f9a79b853907a68e1474/r0002/planeacion.json",
      "sha256": "6873eb5e4a375b54281f3908022e153b8bcf5057d12bb44e0bad1c6cd445fa82",
      "activity_id": "6539"
    }
  }
}
